{
  "record_id": "RWE-P2088-BUILD-098",
  "record_type": "build",
  "project": "Project 2088",
  "canonical_path": "/build/098",
  "canonical_url": "https://realworldentertainment.co.uk/build/098",
  "title": "Project 2088 — Build 098",
  "status": "current",
  "visibility": "public",
  "publish_ready": true,
  "migration_status": "ready",
  "published_at": "2026-09-11T08:14:13Z",
  "summary": "Experimental public Meta Quest development build of Project 2088, preserved as the current public build while active development continues.",
  "tags": [
    "build",
    "098",
    "meta-quest",
    "android-astc",
    "experimental"
  ],
  "related_records": [
    "RWE-P2088-BUILD-097B",
    "RWE-P2088-DEV-158"
  ],
  "source": {
    "provider": "GitHub Releases",
    "release_tag": "Project2088-Build98",
    "release_name": "Build 98",
    "release_url": "https://github.com/theghost25790-lgtm/RealWorldEntertainment/releases/tag/Project2088-Build98"
  },
  "metadata": {
    "build_number": "098",
    "lifecycle_status": "current",
    "release_status": "experimental",
    "platforms": [
      "Meta Quest 2",
      "Meta Quest 3 testing"
    ],
    "package_type": "Android ASTC",
    "pc_requirement": "Windows PC required for installation",
    "asset_name": "Project-2088-Build-098.zip",
    "asset_size_bytes": 1036189758,
    "asset_size_display": "988.2 MiB",
    "sha256": "7e2e647def2d9a38b2058f26e51f5f4c56d069e85c75b8e9e486d498763f4624",
    "download_url": "https://github.com/theghost25790-lgtm/RealWorldEntertainment/releases/download/Project2088-Build98/Project-2088-Build-098.zip",
    "supersedes": "RWE-P2088-BUILD-097B",
    "installation": [
      "Download the complete Build 098 archive.",
      "Extract the entire archive before installation.",
      "Connect the Meta Quest headset to a Windows PC by USB.",
      "Enable Developer Mode and USB debugging and accept the headset debugging request.",
      "Run Install_Project_2088_SD-arm64.bat.",
      "Keep the installer running and launch Project 2088 from Unknown Sources in the headset to bridge the remaining file installation.",
      "Wait for the PC installer to finish before disconnecting.",
      "Launch Project 2088 again from Unknown Sources."
    ]
  }
}